{
  "$schema": "./schemas/bible-books-relay.schema.json",
  "game": "bible-books-relay",
  "version": 1,
  "displayName": "Bible Books Relay",
  "roundsPerSession": 5,
  "sessions": [
    {
      "id": "bbr-session-001",
      "title": "Bible Books Relay Pack 001",
      "theme": "Canonical book order",
      "rounds": [
        {
          "id": "bbr-r001",
          "title": "Pentateuch",
          "section": "Old Testament",
          "books": [
            "Genesis",
            "Exodus",
            "Leviticus",
            "Numbers",
            "Deuteronomy"
          ],
          "difficulty": "easy",
          "teachingNote": "Review Pentateuch and how it connects to the Bible before continuing."
        },
        {
          "id": "bbr-r002",
          "title": "Gospels And Acts",
          "section": "New Testament",
          "books": [
            "Matthew",
            "Mark",
            "Luke",
            "John",
            "Acts"
          ],
          "difficulty": "medium",
          "teachingNote": "Review Gospels And Acts and how it connects to the Bible before continuing."
        },
        {
          "id": "bbr-r003",
          "title": "Early Pauline Epistles",
          "section": "New Testament",
          "books": [
            "Romans",
            "1 Corinthians",
            "2 Corinthians",
            "Galatians",
            "Ephesians",
            "Philippians",
            "Colossians",
            "1 Thessalonians",
            "2 Thessalonians",
            "1 Timothy"
          ],
          "difficulty": "hard",
          "teachingNote": "Review Early Pauline Epistles and how it connects to the Bible before continuing."
        },
        {
          "id": "bbr-r004",
          "title": "Minor Prophets Opening Run",
          "section": "Old Testament",
          "books": [
            "Hosea",
            "Joel",
            "Amos",
            "Obadiah",
            "Jonah",
            "Micah",
            "Nahum",
            "Habakkuk",
            "Zephaniah",
            "Haggai"
          ],
          "difficulty": "easy",
          "teachingNote": "Review Minor Prophets Opening Run and how it connects to the Bible before continuing."
        },
        {
          "id": "bbr-r005",
          "title": "Wisdom And Major Prophets",
          "section": "Old Testament",
          "books": [
            "Job",
            "Psalms",
            "Proverbs",
            "Ecclesiastes",
            "Song of Solomon",
            "Isaiah",
            "Jeremiah",
            "Lamentations",
            "Ezekiel",
            "Daniel"
          ],
          "difficulty": "medium",
          "teachingNote": "Review Wisdom And Major Prophets and how it connects to the Bible before continuing."
        }
      ]
    },
    {
      "id": "bbr-session-002",
      "title": "Bible Books Relay Pack 002",
      "theme": "Canonical book order",
      "rounds": [
        {
          "id": "bbr-r006",
          "title": "General Epistles",
          "section": "New Testament",
          "books": [
            "Hebrews",
            "James",
            "1 Peter",
            "2 Peter",
            "1 John",
            "2 John",
            "3 John",
            "Jude",
            "Revelation"
          ],
          "difficulty": "hard",
          "teachingNote": "Review General Epistles and how it connects to the Bible before continuing."
        },
        {
          "id": "bbr-r007",
          "title": "Historical Books",
          "section": "Old Testament",
          "books": [
            "Joshua",
            "Judges",
            "Ruth",
            "1 Samuel",
            "2 Samuel",
            "1 Kings",
            "2 Kings",
            "1 Chronicles",
            "2 Chronicles",
            "Ezra"
          ],
          "difficulty": "easy",
          "teachingNote": "Review Historical Books and how it connects to the Bible before continuing."
        },
        {
          "id": "bbr-r008",
          "title": "Whole Bible Starter",
          "section": "Whole Bible",
          "books": [
            "Genesis",
            "Joshua",
            "Psalms",
            "Isaiah",
            "Matthew",
            "Acts",
            "Romans",
            "Hebrews",
            "Revelation"
          ],
          "difficulty": "medium",
          "teachingNote": "Review Whole Bible Starter and how it connects to the Bible before continuing."
        },
        {
          "id": "bbr-r009",
          "title": "New Testament Middle",
          "section": "New Testament",
          "books": [
            "Acts",
            "Romans",
            "1 Corinthians",
            "2 Corinthians",
            "Galatians",
            "Ephesians",
            "Philippians",
            "Colossians"
          ],
          "difficulty": "hard",
          "teachingNote": "Review New Testament Middle and how it connects to the Bible before continuing."
        },
        {
          "id": "bbr-r010",
          "title": "Minor Prophets Closing Run",
          "section": "Old Testament",
          "books": [
            "Micah",
            "Nahum",
            "Habakkuk",
            "Zephaniah",
            "Haggai",
            "Zechariah",
            "Malachi"
          ],
          "difficulty": "easy",
          "teachingNote": "Review Minor Prophets Closing Run and how it connects to the Bible before continuing."
        }
      ]
    },
    {
      "id": "bbr-session-003",
      "title": "Bible Books Relay Pack 003",
      "theme": "Canonical book order",
      "rounds": [
        {
          "id": "bbr-r011",
          "title": "Captivity To Restoration",
          "section": "Old Testament",
          "books": [
            "2 Chronicles",
            "Ezra",
            "Nehemiah",
            "Esther",
            "Job",
            "Psalms",
            "Proverbs"
          ],
          "difficulty": "medium",
          "teachingNote": "Review Captivity To Restoration and how it connects to the Bible before continuing."
        },
        {
          "id": "bbr-r012",
          "title": "Whole Bible Finish",
          "section": "Whole Bible",
          "books": [
            "Daniel",
            "Jonah",
            "Malachi",
            "Matthew",
            "John",
            "Acts",
            "Romans",
            "James",
            "Jude",
            "Revelation"
          ],
          "difficulty": "hard",
          "teachingNote": "Review Whole Bible Finish and how it connects to the Bible before continuing."
        },
        {
          "id": "bbr-r013",
          "title": "Law Relay 2",
          "section": "Exodus through Joshua",
          "books": [
            "Exodus",
            "Leviticus",
            "Numbers",
            "Deuteronomy",
            "Joshua"
          ],
          "difficulty": "easy",
          "teachingNote": "Review Law Relay 2 and how it connects to the Bible before continuing."
        },
        {
          "id": "bbr-r014",
          "title": "Law Relay 3",
          "section": "Leviticus through Judges",
          "books": [
            "Leviticus",
            "Numbers",
            "Deuteronomy",
            "Joshua",
            "Judges"
          ],
          "difficulty": "medium",
          "teachingNote": "Review Law Relay 3 and how it connects to the Bible before continuing."
        },
        {
          "id": "bbr-r015",
          "title": "Law Relay 4",
          "section": "Numbers through Ruth",
          "books": [
            "Numbers",
            "Deuteronomy",
            "Joshua",
            "Judges",
            "Ruth"
          ],
          "difficulty": "hard",
          "teachingNote": "Review Law Relay 4 and how it connects to the Bible before continuing."
        }
      ]
    },
    {
      "id": "bbr-session-004",
      "title": "Bible Books Relay Pack 004",
      "theme": "Canonical book order",
      "rounds": [
        {
          "id": "bbr-r016",
          "title": "Law Relay 5",
          "section": "Deuteronomy through 1 Samuel",
          "books": [
            "Deuteronomy",
            "Joshua",
            "Judges",
            "Ruth",
            "1 Samuel"
          ],
          "difficulty": "easy",
          "teachingNote": "Review Law Relay 5 and how it connects to the Bible before continuing."
        },
        {
          "id": "bbr-r017",
          "title": "History Relay 6",
          "section": "Joshua through 2 Samuel",
          "books": [
            "Joshua",
            "Judges",
            "Ruth",
            "1 Samuel",
            "2 Samuel"
          ],
          "difficulty": "medium",
          "teachingNote": "Review History Relay 6 and how it connects to the Bible before continuing."
        },
        {
          "id": "bbr-r018",
          "title": "History Relay 7",
          "section": "Judges through 1 Kings",
          "books": [
            "Judges",
            "Ruth",
            "1 Samuel",
            "2 Samuel",
            "1 Kings"
          ],
          "difficulty": "hard",
          "teachingNote": "Review History Relay 7 and how it connects to the Bible before continuing."
        },
        {
          "id": "bbr-r019",
          "title": "History Relay 8",
          "section": "Ruth through 2 Kings",
          "books": [
            "Ruth",
            "1 Samuel",
            "2 Samuel",
            "1 Kings",
            "2 Kings"
          ],
          "difficulty": "easy",
          "teachingNote": "Review History Relay 8 and how it connects to the Bible before continuing."
        },
        {
          "id": "bbr-r020",
          "title": "History Relay 9",
          "section": "1 Samuel through 1 Chronicles",
          "books": [
            "1 Samuel",
            "2 Samuel",
            "1 Kings",
            "2 Kings",
            "1 Chronicles"
          ],
          "difficulty": "medium",